{
  "$schema": "https://json-schema.org/draft/2020-12/schema",
  "$id": "https://github.com/smart_band_10/shared/schema.json",
  "title": "Band schedule payload",
  "description": "Response of GET /api/v1/schedule. Keys are short on purpose: this travels over BLE to a watch.",
  "type": "object",
  "additionalProperties": false,
  "required": ["v", "gid", "gen", "src", "stale", "h", "days"],
  "properties": {
    "v": {
      "description": "Wire format version. Bump on any breaking change.",
      "type": "integer",
      "const": 1
    },
    "gid": {
      "description": "Group id in the university system.",
      "type": "integer",
      "minimum": 1
    },
    "g": {
      "description": "Group name, e.g. МБС-301-О-01. Null if upstream never reported one.",
      "type": ["string", "null"],
      "maxLength": 32
    },
    "gen": {
      "description": "When this response was generated, ISO 8601 with offset.",
      "type": "string",
      "format": "date-time"
    },
    "src": {
      "description": "When the underlying snapshot was fetched from the university.",
      "type": "string",
      "format": "date-time"
    },
    "stale": {
      "description": "True when the snapshot is older than two fetch intervals.",
      "type": "boolean"
    },
    "h": {
      "description": "First 12 hex chars of SHA-256 over the canonical `days` JSON. Also the ETag.",
      "type": "string",
      "pattern": "^[0-9a-f]{12}$"
    },
    "days": {
      "description": "Days that actually have lessons, ascending. May be empty: the university publishes only about ten days ahead.",
      "type": "array",
      "minItems": 0,
      "items": { "$ref": "#/$defs/day" }
    }
  },
  "$defs": {
    "day": {
      "type": "object",
      "additionalProperties": false,
      "required": ["d", "l"],
      "properties": {
        "d": {
          "description": "Date, YYYY-MM-DD, in Asia/Omsk.",
          "type": "string",
          "pattern": "^\\d{4}-\\d{2}-\\d{2}$"
        },
        "l": {
          "description": "Lessons of that day, ordered by pair number.",
          "type": "array",
          "minItems": 1,
          "items": { "$ref": "#/$defs/lesson" }
        }
      }
    },
    "lesson": {
      "type": "object",
      "additionalProperties": false,
      "required": ["p", "n", "t"],
      "properties": {
        "p": {
          "description": "Pair number. Times are not transmitted; the watch has bells.json.",
          "type": "integer",
          "minimum": 1,
          "maximum": 8
        },
        "n": {
          "description": "Subject name, abbreviated to fit the watch screen.",
          "type": "string",
          "minLength": 1,
          "maxLength": 32
        },
        "t": {
          "description": "Lesson type: Лек, Прак, Лаб, Практ, Практика. May be empty if upstream omitted it.",
          "type": "string",
          "maxLength": 16
        },
        "r": {
          "description": "Room as building-number, e.g. 4-101. Null when unknown (upstream 4-0).",
          "type": ["string", "null"],
          "maxLength": 16
        },
        "tc": {
          "description": "Teacher as surname plus initials. Null when upstream has none.",
          "type": ["string", "null"],
          "maxLength": 48
        },
        "sg": {
          "description": "Subgroup number, or null for a lesson the whole group attends.",
          "type": ["integer", "null"],
          "minimum": 1,
          "maximum": 9
        }
      }
    }
  }
}
