{
 "v": 1,
 "gid": 5028,
 "g": "МБС-301-О-01",
 "gen": "2026-09-16T14:02:44+06:00",
 "src": "2026-09-16T14:02:44+06:00",
 "stale": false,
 "h": "70bbe23f4e25",
 "days": [
  {
   "d": "2026-09-16",
   "l": [
    {
     "p": 1,
     "n": "Методы вычислений",
     "t": "Практ",
     "r": "4-303",
     "tc": "Макаров С. Е.",
     "sg": null
    },
    {
     "p": 2,
     "n": "Квантовые вычисления",
     "t": "Лек",
     "r": "4-309",
     "tc": "Вакилов А. Н.",
     "sg": null
    },
    {
     "p": 3,
     "n": "Теория инф.",
     "t": "Лек",
     "r": "4-303",
     "tc": "Бесценный И. П.",
     "sg": null
    },
    {
     "p": 4,
     "n": "Теория инф.",
     "t": "Прак",
     "r": "4-303",
     "tc": "Бесценный И. П.",
     "sg": null
    }
   ]
  },
  {
   "d": "2026-09-17",
   "l": [
    {
     "p": 2,
     "n": "Осн. постр. защищ. баз данных",
     "t": "Лек",
     "r": "4-206",
     "tc": "Опарина Т. М.",
     "sg": null
    },
    {
     "p": 3,
     "n": "Алг. кодирования и сжатия инф.",
     "t": "Лаб",
     "r": "4-317",
     "tc": "Тутов В. А.",
     "sg": 1
    },
    {
     "p": 3,
     "n": "Осн. постр. защищ. баз данных",
     "t": "Лаб",
     "r": "4-219",
     "tc": "Опарина Т. М.",
     "sg": 2
    },
    {
     "p": 4,
     "n": "Осн. постр. защищ. баз данных",
     "t": "Лаб",
     "r": "4-219",
     "tc": "Опарина Т. М.",
     "sg": 1
    },
    {
     "p": 4,
     "n": "Алг. кодирования и сжатия инф.",
     "t": "Лаб",
     "r": "4-317",
     "tc": "Тутов В. А.",
     "sg": 2
    }
   ]
  },
  {
   "d": "2026-09-19",
   "l": [
    {
     "p": 3,
     "n": "Сети и сист. передачи инф.",
     "t": "Лаб",
     "r": "4-301",
     "tc": "Гусс С. В.",
     "sg": 1
    },
    {
     "p": 4,
     "n": "Сети и сист. передачи инф.",
     "t": "Лаб",
     "r": "4-301",
     "tc": "Гусс С. В.",
     "sg": 1
    }
   ]
  },
  {
   "d": "2026-09-21",
   "l": [
    {
     "p": 1,
     "n": "Защита в опер. сист.",
     "t": "Лек",
     "r": "4-301",
     "tc": "Гусс С. В.",
     "sg": null
    },
    {
     "p": 2,
     "n": "Защита в опер. сист.",
     "t": "Практ",
     "r": "4-301",
     "tc": "Гусс С. В.",
     "sg": null
    },
    {
     "p": 3,
     "n": "Защита в опер. сист.",
     "t": "Практ",
     "r": "4-301",
     "tc": "Гусс С. В.",
     "sg": null
    },
    {
     "p": 4,
     "n": "Инф. сист. и техн.",
     "t": "Практ",
     "r": "4-219",
     "tc": "Лейхтер С. В.",
     "sg": null
    }
   ]
  },
  {
   "d": "2026-09-22",
   "l": [
    {
     "p": 1,
     "n": "Алг. кодирования и сжатия инф.",
     "t": "Лек",
     "r": "4-309",
     "tc": "Бесценный И. П.",
     "sg": null
    },
    {
     "p": 2,
     "n": "Методы вычислений",
     "t": "Лек",
     "r": "4-114",
     "tc": "Макаров С. Е.",
     "sg": null
    },
    {
     "p": 5,
     "n": "Крипт. протоколы",
     "t": "Лек",
     "r": null,
     "tc": "Мироненко А. Н.",
     "sg": null
    },
    {
     "p": 6,
     "n": "Крипт. протоколы",
     "t": "Практ",
     "r": null,
     "tc": "Мироненко А. Н.",
     "sg": null
    }
   ]
  },
  {
   "d": "2026-09-23",
   "l": [
    {
     "p": 1,
     "n": "Методы вычислений",
     "t": "Практ",
     "r": "4-303",
     "tc": "Макаров С. Е.",
     "sg": null
    },
    {
     "p": 2,
     "n": "Квантовые вычисления",
     "t": "Лек",
     "r": "4-309",
     "tc": "Вакилов А. Н.",
     "sg": null
    },
    {
     "p": 3,
     "n": "Теория инф.",
     "t": "Лек",
     "r": "4-303",
     "tc": "Бесценный И. П.",
     "sg": null
    },
    {
     "p": 4,
     "n": "Теория инф.",
     "t": "Прак",
     "r": "4-303",
     "tc": "Бесценный И. П.",
     "sg": null
    }
   ]
  },
  {
   "d": "2026-09-24",
   "l": [
    {
     "p": 2,
     "n": "Осн. постр. защищ. баз данных",
     "t": "Лек",
     "r": "4-206",
     "tc": "Опарина Т. М.",
     "sg": null
    },
    {
     "p": 3,
     "n": "Алг. кодирования и сжатия инф.",
     "t": "Лаб",
     "r": "4-317",
     "tc": "Тутов В. А.",
     "sg": 1
    },
    {
     "p": 3,
     "n": "Осн. постр. защищ. баз данных",
     "t": "Лаб",
     "r": "4-219",
     "tc": "Опарина Т. М.",
     "sg": 2
    },
    {
     "p": 4,
     "n": "Осн. постр. защищ. баз данных",
     "t": "Лаб",
     "r": "4-219",
     "tc": "Опарина Т. М.",
     "sg": 1
    },
    {
     "p": 4,
     "n": "Алг. кодирования и сжатия инф.",
     "t": "Лаб",
     "r": "4-317",
     "tc": "Тутов В. А.",
     "sg": 2
    }
   ]
  },
  {
   "d": "2026-09-25",
   "l": [
    {
     "p": 1,
     "n": "Производств. практика",
     "t": "Практика",
     "r": null,
     "tc": null,
     "sg": null
    },
    {
     "p": 2,
     "n": "Производств. практика",
     "t": "Практика",
     "r": null,
     "tc": null,
     "sg": null
    },
    {
     "p": 3,
     "n": "Производств. практика",
     "t": "Практика",
     "r": null,
     "tc": null,
     "sg": null
    },
    {
     "p": 4,
     "n": "Производств. практика",
     "t": "Практика",
     "r": null,
     "tc": null,
     "sg": null
    }
   ]
  },
  {
   "d": "2026-09-26",
   "l": [
    {
     "p": 3,
     "n": "Сети и сист. передачи инф.",
     "t": "Лаб",
     "r": "4-301",
     "tc": "Гусс С. В.",
     "sg": 2
    },
    {
     "p": 4,
     "n": "Сети и сист. передачи инф.",
     "t": "Лаб",
     "r": "4-301",
     "tc": "Гусс С. В.",
     "sg": 2
    }
   ]
  }
 ]
}
